{
    "תיאור המסמך": "בקשה להעברת כספים",
    "מאפיינים שחולצו": {
      "פרטי השולח": {
        "שם המוסד": "Schusterman Center for Israel Studies, Brandeis University",
        "שם איש קשר": "Alexander Kaye",
        "תפקיד": "Director, Karl, Harry, and Helen Stoll Chair in Israel Studies Associate Professor, Department of Near Eastern and Judaic Studies",
        "כתובת": "Mailstop 060 . PO Box 549110 . Waltham, Massachusetts . 02454-9110",
        "טלפון": "781-736-5927",
        "אימייל": "alexanderkaye@brandeis.edu"
      },
      "פרטי הנמען": {
        "שם המוסד": "University of Haifa",
        "שם איש קשר": "Prof. David Barak-Gorodetsky",
        "תפקיד": "Director, Ruderman Program for American Jewish Studies",
        "כתובת": "Department of Israel Studies University of Haifa Mount Carmel Haifa 3498838"
      },
      "פרטי תשלום": {
        "סכום לתשלום": "72,555",
        "מטבע": "USD",
        "מטרת התשלום": "These funds will be designated to cover expenses of the University of Haifa/Ruderman Program's 2024 summer trip to Boston and New York, which Brandeis hosted in June 2024."
      },
      "פרטי בנק": {
        "שם הבנק": "JPMorgan Chase Bank N.A.",
        "מיקום הבנק": "New York, NY 10017",
        "מספר ABA": "021000021",
        "קוד Swift": "CHASUS33",
        "שם בעל החשבון": "Brandeis University",
        "מספר חשבון": "454985719",
        "הערת ייחוס": "University of Haifa/Ruderman for Schusterman Center GR404590"
      },
      "פרטי מסמך": {
        "תאריך המסמך": "November 22, 2024"
      },
      "בקשת פעולה": {
        "פעולה נדרשת": "Please let me know when the wire transfer is complete, so I can track it."
      }
    },
    "טקסט מלא": "Schusterman Center for Israel Studies Brandeis University\nAlexander Kaye Director\nKarl, Harry, and Helen Stoll Chair in Israel Studies Associate Professor, Department of Near Eastern and Judaic Studies\nNovember 22, 2024\nProf. David Barak-Gorodetsky Director, Ruderman Program for American Jewish Studies Department of Israel Studies University of Haifa Mount Carmel Haifa 3498838\nDear Prof. Barak-Gorodetsky,\nI am writing to request that the University of Haifa transfer $72,555 to the Schusterman Center for Israel Studies at Brandeis University. These funds will be designated to cover expenses of the University of Haifa/Ruderman Program's 2024 summer trip to Boston and New York, which Brandeis hosted in June 2024.\nBelow are Brandeis's bank details for a wire transfer:\nINTERNATIONAL WIRE: Bank: JPMorgan Chase Bank N.A. Location: New York, NY 10017 ABA: 021000021\nSwift Code: CHASUS33 (for International wires only)\nAccount Name: Brandeis University\nAccount No: 454985719\nReference: University of Haifa/Ruderman for Schusterman Center GR404590\nPlease let me know when the wire transfer is complete, so I can track it.\nThank you, &. lay Alex Kaye\nMailstop 060 . PO Box 549110 . Waltham, Massachusetts . 02454-9110 Tel: 781- 736-5927 . alexanderkaye@brandeis.edu . brandeis.edu/israelcenter"
  }